{
  "version": "v1",
  "generatedAt": "2026-03-21T12:11:18.535Z",
  "count": 275,
  "firstTimestamp": "2026-02-07T10:02:53Z",
  "lastTimestamp": "2026-03-21T05:24:14Z",
  "availableDates": [
    "2026-02-07",
    "2026-02-08",
    "2026-02-10",
    "2026-02-11",
    "2026-02-12",
    "2026-02-22",
    "2026-02-23",
    "2026-02-24",
    "2026-02-25",
    "2026-02-26",
    "2026-02-27",
    "2026-02-28",
    "2026-03-01",
    "2026-03-02",
    "2026-03-03",
    "2026-03-04",
    "2026-03-05",
    "2026-03-06",
    "2026-03-07",
    "2026-03-08",
    "2026-03-09",
    "2026-03-10",
    "2026-03-11",
    "2026-03-12",
    "2026-03-13",
    "2026-03-15",
    "2026-03-16",
    "2026-03-17",
    "2026-03-18",
    "2026-03-19",
    "2026-03-21"
  ],
  "dateEndpoints": [
    {
      "date": "2026-02-07",
      "endpoint": "by-date/2026-02-07.json",
      "count": 6
    },
    {
      "date": "2026-02-08",
      "endpoint": "by-date/2026-02-08.json",
      "count": 2
    },
    {
      "date": "2026-02-10",
      "endpoint": "by-date/2026-02-10.json",
      "count": 4
    },
    {
      "date": "2026-02-11",
      "endpoint": "by-date/2026-02-11.json",
      "count": 6
    },
    {
      "date": "2026-02-12",
      "endpoint": "by-date/2026-02-12.json",
      "count": 4
    },
    {
      "date": "2026-02-22",
      "endpoint": "by-date/2026-02-22.json",
      "count": 4
    },
    {
      "date": "2026-02-23",
      "endpoint": "by-date/2026-02-23.json",
      "count": 8
    },
    {
      "date": "2026-02-24",
      "endpoint": "by-date/2026-02-24.json",
      "count": 16
    },
    {
      "date": "2026-02-25",
      "endpoint": "by-date/2026-02-25.json",
      "count": 8
    },
    {
      "date": "2026-02-26",
      "endpoint": "by-date/2026-02-26.json",
      "count": 12
    },
    {
      "date": "2026-02-27",
      "endpoint": "by-date/2026-02-27.json",
      "count": 14
    },
    {
      "date": "2026-02-28",
      "endpoint": "by-date/2026-02-28.json",
      "count": 15
    },
    {
      "date": "2026-03-01",
      "endpoint": "by-date/2026-03-01.json",
      "count": 10
    },
    {
      "date": "2026-03-02",
      "endpoint": "by-date/2026-03-02.json",
      "count": 10
    },
    {
      "date": "2026-03-03",
      "endpoint": "by-date/2026-03-03.json",
      "count": 10
    },
    {
      "date": "2026-03-04",
      "endpoint": "by-date/2026-03-04.json",
      "count": 15
    },
    {
      "date": "2026-03-05",
      "endpoint": "by-date/2026-03-05.json",
      "count": 17
    },
    {
      "date": "2026-03-06",
      "endpoint": "by-date/2026-03-06.json",
      "count": 12
    },
    {
      "date": "2026-03-07",
      "endpoint": "by-date/2026-03-07.json",
      "count": 12
    },
    {
      "date": "2026-03-08",
      "endpoint": "by-date/2026-03-08.json",
      "count": 12
    },
    {
      "date": "2026-03-09",
      "endpoint": "by-date/2026-03-09.json",
      "count": 12
    },
    {
      "date": "2026-03-10",
      "endpoint": "by-date/2026-03-10.json",
      "count": 12
    },
    {
      "date": "2026-03-11",
      "endpoint": "by-date/2026-03-11.json",
      "count": 6
    },
    {
      "date": "2026-03-12",
      "endpoint": "by-date/2026-03-12.json",
      "count": 6
    },
    {
      "date": "2026-03-13",
      "endpoint": "by-date/2026-03-13.json",
      "count": 6
    },
    {
      "date": "2026-03-15",
      "endpoint": "by-date/2026-03-15.json",
      "count": 6
    },
    {
      "date": "2026-03-16",
      "endpoint": "by-date/2026-03-16.json",
      "count": 6
    },
    {
      "date": "2026-03-17",
      "endpoint": "by-date/2026-03-17.json",
      "count": 6
    },
    {
      "date": "2026-03-18",
      "endpoint": "by-date/2026-03-18.json",
      "count": 6
    },
    {
      "date": "2026-03-19",
      "endpoint": "by-date/2026-03-19.json",
      "count": 6
    },
    {
      "date": "2026-03-21",
      "endpoint": "by-date/2026-03-21.json",
      "count": 6
    }
  ]
}